{
  "schema_version": 1,
  "run_id": "fixture-run",
  "phase_id": "phase-1",
  "wave_id": 1,
  "spec_revision": "fixture-run:wave-1:abc",
  "correlation_id": "corr-1",
  "slot_id": "CODE-1",
  "attempt_id": 1,
  "hypothesis_id": "H-1",
  "status": "COMPLETE",
  "fact": "The fixture contract exists.",
  "evidence_refs": ["file:.cursor/schemas/packets/slot-report-v1.json"],
  "confidence": "100%",
  "confidence_basis": "The fixture schema is directly present.",
  "model": "fixture-model",
  "next_question": null,
  "degraded": null
}
